{
  "$schema": "https://json-schema.org/draft/2020-12/schema",
  "$id": "hook-variant.schema.json",
  "title": "OMA Hook Variant",
  "description": "Vendor-specific hook registration config. SSOT: .agents/hooks/variants/",
  "type": "object",
  "required": ["vendor", "hookDir", "settingsFile", "runtime", "events"],
  "additionalProperties": false,
  "properties": {
    "$schema": {
      "type": "string",
      "description": "JSON Schema reference for IDE support."
    },
    "vendor": {
      "type": "string",
      "description": "Vendor identifier matching VendorType in cli/types.",
      "enum": [
        "antigravity",
        "claude",
        "codex",
        "commandcode",
        "cursor",
        "grok",
        "kimi",
        "kiro",
        "qwen"
      ]
    },
    "hookDir": {
      "type": "string",
      "description": "Relative path to the vendor's hooks directory (e.g., .claude/hooks)."
    },
    "settingsFile": {
      "type": "string",
      "description": "Relative path to the vendor's settings file where hook entries are registered."
    },
    "projectDirEnv": {
      "type": ["string", "null"],
      "description": "Environment variable for the project root (e.g., CLAUDE_PROJECT_DIR). null = use relative paths."
    },
    "runtime": {
      "type": "string",
      "description": "Runtime to execute hook scripts.",
      "default": "bun"
    },
    "homeOnly": {
      "type": "boolean",
      "description": "When true, the vendor's runtime config lives outside the project (agy: settings/HUD in ~/.gemini/antigravity-cli/, workspace hooks in .agents/hooks.json via its dedicated installer). The generic project-variant install (installHooksFromVariant) is skipped — the vendor never reads project-scoped copies of hookDir/settingsFile.",
      "default": false
    },
    "events": {
      "type": "object",
      "description": "Map of vendor event names to hook configs. Keys are vendor-specific event names (e.g., PreToolUse, BeforeTool). Value may be a single hook entry or an ordered array of entries (chained).",
      "additionalProperties": {
        "oneOf": [
          {
            "$ref": "#/$defs/hookEvent"
          },
          {
            "type": "array",
            "items": {
              "$ref": "#/$defs/hookEvent"
            },
            "minItems": 1
          }
        ]
      },
      "minProperties": 1
    },
    "statusLine": {
      "type": "object",
      "description": "Hook script for the status line display (Claude / agy use root statusLine; Qwen nests under ui via statusLineKey).",
      "required": ["hook"],
      "additionalProperties": false,
      "properties": {
        "hook": {
          "type": "string",
          "description": "Filename of the hook script in .agents/hooks/core/."
        },
        "options": {
          "type": "object",
          "description": "Extra vendor statusLine fields written alongside type/command (e.g. Qwen respectUserColors, hideContextIndicator).",
          "additionalProperties": true
        }
      }
    },
    "statusLineKey": {
      "type": "string",
      "description": "Parent settings key to nest statusLine under. Omit for root-level (Claude/agy). Qwen requires \"ui\" \u2014 a root-level statusLine is ignored by the Qwen renderer."
    },
    "extra": {
      "type": "object",
      "description": "Additional top-level settings to merge (e.g., permissions)."
    },
    "featureFlags": {
      "$ref": "#/$defs/featureFlags",
      "description": "Vendor-specific feature flags to enable (e.g., Codex config.toml)."
    },
    "flatHookEntries": {
      "type": "boolean",
      "description": "When true, settings hook entries are written as flat {command, timeout[, matcher]} objects under each event key (Cursor hooks.json format) instead of nested {matcher, hooks:[...]} groups (Claude Code format)."
    },
    "skipSettingsMerge": {
      "type": "boolean",
      "description": "When true, the generic installer copies hook scripts and writes the oma-hook.sh wrapper but does NOT merge hook entries into settingsFile. Used by Kiro, whose CLI reads hooks from a dedicated agent config (.kiro/agents/oma-hooks.json via applyKiroOmaHooksAgent) — the generic .kiro/settings/cli.json merge would be dead config Kiro never reads. `extra` (statusLine/permissions) is still applied when present.",
      "default": false
    }
  },
  "$defs": {
    "hookEvent": {
      "type": "object",
      "description": "A hook event registration entry.",
      "required": ["hook", "timeout"],
      "additionalProperties": false,
      "properties": {
        "hook": {
          "type": "string",
          "description": "Filename of the hook script in .agents/hooks/core/."
        },
        "matcher": {
          "type": "string",
          "description": "Tool or agent matcher pattern (e.g., Bash, *). Omit if not applicable."
        },
        "timeout": {
          "type": "integer",
          "description": "Max execution time in seconds.",
          "minimum": 1,
          "maximum": 30,
          "default": 5
        },
        "loopLimit": {
          "type": ["integer", "null"],
          "description": "Cursor `stop` hook only: caps how many times the hook may auto-resubmit a followup_message (Cursor's loop_limit). null = uncapped; omit for Cursor's default (5). Ignored by other vendors."
        }
      }
    },
    "hookRef": {
      "type": "object",
      "description": "Reference to a hook script in core/.",
      "required": ["hook"],
      "additionalProperties": false,
      "properties": {
        "hook": {
          "type": "string",
          "description": "Filename of the hook script in .agents/hooks/core/."
        }
      }
    },
    "featureFlags": {
      "type": "object",
      "description": "Feature flags to enable in a vendor config file.",
      "required": ["file", "section", "flags"],
      "additionalProperties": false,
      "properties": {
        "file": {
          "type": "string",
          "description": "Relative path to the config file (e.g., .codex/config.toml)."
        },
        "section": {
          "type": "string",
          "description": "TOML section name (e.g., features)."
        },
        "flags": {
          "type": "object",
          "description": "Key-value pairs of flags to set.",
          "additionalProperties": {
            "type": "boolean"
          }
        }
      }
    }
  }
}
