{
  "$schema": "./hook-variant.schema.json",
  "vendor": "kiro",
  "hookDir": ".kiro/hooks",
  "settingsFile": ".kiro/settings/cli.json",
  "projectDirEnv": null,
  "runtime": "bun",
  "skipSettingsMerge": true,
  "events": {
    "userPromptSubmit": [
      {
        "hook": "keyword-detector.ts",
        "timeout": 5
      },
      {
        "hook": "state-boundary.ts",
        "timeout": 5
      },
      {
        "hook": "skill-injector.ts",
        "timeout": 3
      },
      {
        "hook": "code-intelligence-primer.ts",
        "timeout": 3
      }
    ],
    "preToolUse": [
      {
        "hook": "scm-guard.ts",
        "matcher": "shell",
        "timeout": 3
      },
      {
        "hook": "code-intelligence-guard.ts",
        "matcher": "shell",
        "timeout": 2
      },
      {
        "hook": "test-filter.ts",
        "matcher": "shell",
        "timeout": 5
      }
    ],
    "postToolUse": [
      {
        "hook": "refactor-guard.ts",
        "matcher": "fs_write",
        "timeout": 5
      }
    ],
    "stop": [
      {
        "hook": "persistent-mode.ts",
        "timeout": 30
      },
      {
        "hook": "refactor-guard.ts",
        "timeout": 5
      }
    ]
  }
}
