{
  "$schema": "./hook-variant.schema.json",
  "vendor": "claude",
  "hookDir": ".claude/hooks",
  "settingsFile": ".claude/settings.json",
  "projectDirEnv": "CLAUDE_PROJECT_DIR",
  "runtime": "bun",
  "events": {
    "SessionStart": [
      {
        "hook": "code-intelligence-primer.ts",
        "timeout": 3
      },
      {
        "hook": "state-boundary.ts",
        "timeout": 5
      }
    ],
    "UserPromptSubmit": [
      {
        "hook": "keyword-detector.ts",
        "timeout": 2
      },
      {
        "hook": "state-boundary.ts",
        "timeout": 4
      },
      {
        "hook": "skill-injector.ts",
        "timeout": 2
      },
      {
        "hook": "code-intelligence-primer.ts",
        "timeout": 2
      }
    ],
    "PreToolUse": [
      {
        "hook": "scm-guard.ts",
        "matcher": "Bash",
        "timeout": 3
      },
      {
        "hook": "code-intelligence-guard.ts",
        "matcher": "Grep|Glob",
        "timeout": 2
      },
      {
        "hook": "test-filter.ts",
        "matcher": "Bash",
        "timeout": 5
      }
    ],
    "PostToolUse": [
      {
        "hook": "refactor-guard.ts",
        "matcher": "Edit|Write|NotebookEdit",
        "timeout": 5
      }
    ],
    "Stop": [
      {
        "hook": "persistent-mode.ts",
        "timeout": 30
      },
      {
        "hook": "refactor-guard.ts",
        "timeout": 5
      }
    ]
  },
  "statusLine": {
    "hook": "hud.ts"
  },
  "extra": {
    "permissions": {
      "allow": [
        "Bash(bun run:*)",
        "Bash(bunx tsx:*)",
        "Bash(git add:*)",
        "Bash(ls *)",
        "Bash(oma *)",
        "mcp__serena__*"
      ]
    }
  }
}
