{
  "$schema": "./hook-variant.schema.json",
  "vendor": "cursor",
  "hookDir": ".cursor/hooks",
  "settingsFile": ".cursor/hooks.json",
  "projectDirEnv": null,
  "runtime": "bun",
  "flatHookEntries": true,
  "events": {
    "beforeSubmitPrompt": [
      {
        "hook": "keyword-detector.ts",
        "timeout": 5
      },
      {
        "hook": "state-boundary.ts",
        "timeout": 5
      },
      {
        "hook": "skill-injector.ts",
        "timeout": 3
      },
      {
        "hook": "code-intelligence-primer.ts",
        "timeout": 3
      }
    ],
    "preToolUse": [
      {
        "hook": "scm-guard.ts",
        "matcher": "Shell",
        "timeout": 3
      },
      {
        "hook": "code-intelligence-guard.ts",
        "matcher": "Shell",
        "timeout": 2
      },
      {
        "hook": "test-filter.ts",
        "matcher": "Shell",
        "timeout": 5
      }
    ],
    "afterFileEdit": [
      {
        "hook": "refactor-guard.ts",
        "timeout": 5
      }
    ],
    "stop": [
      {
        "hook": "persistent-mode.ts",
        "timeout": 30,
        "loopLimit": null
      },
      {
        "hook": "refactor-guard.ts",
        "timeout": 5
      }
    ],
    "sessionStart": [
      {
        "hook": "code-intelligence-primer.ts",
        "timeout": 3
      },
      {
        "hook": "state-boundary.ts",
        "timeout": 5
      }
    ]
  },
  "extra": {
    "version": 1
  }
}
