{
  "$schema": "./hook-variant.schema.json",
  "vendor": "kimi",
  "hookDir": ".agents/hooks/core",
  "settingsFile": ".kimi-code/config.toml",
  "projectDirEnv": null,
  "runtime": "bun",
  "homeOnly": true,
  "events": {
    "UserPromptSubmit": [
      {
        "hook": "keyword-detector.ts",
        "timeout": 5
      },
      {
        "hook": "state-boundary.ts",
        "timeout": 5
      },
      {
        "hook": "skill-injector.ts",
        "timeout": 3
      },
      {
        "hook": "code-intelligence-primer.ts",
        "timeout": 3
      }
    ],
    "PreToolUse": [
      {
        "hook": "scm-guard.ts",
        "matcher": "Bash",
        "timeout": 3
      },
      {
        "hook": "code-intelligence-guard.ts",
        "matcher": "Bash",
        "timeout": 2
      },
      {
        "hook": "test-filter.ts",
        "matcher": "Bash",
        "timeout": 5
      }
    ],
    "PostToolUse": [
      {
        "hook": "refactor-guard.ts",
        "matcher": "WriteFile|StrReplaceFile",
        "timeout": 5
      }
    ],
    "Stop": [
      {
        "hook": "persistent-mode.ts",
        "timeout": 30
      },
      {
        "hook": "refactor-guard.ts",
        "timeout": 5
      }
    ]
  }
}
