{
  "$schema": "./hook-variant.schema.json",
  "vendor": "codex",
  "hookDir": ".codex/hooks",
  "settingsFile": ".codex/hooks.json",
  "projectDirEnv": null,
  "runtime": "bun",
  "events": {
    "UserPromptSubmit": [
      {
        "hook": "keyword-detector.ts",
        "timeout": 5
      },
      {
        "hook": "state-boundary.ts",
        "timeout": 5
      },
      {
        "hook": "skill-injector.ts",
        "timeout": 3
      },
      {
        "hook": "code-intelligence-primer.ts",
        "timeout": 3
      }
    ],
    "PreToolUse": [
      {
        "hook": "scm-guard.ts",
        "matcher": "Bash",
        "timeout": 3
      },
      {
        "hook": "code-intelligence-guard.ts",
        "matcher": "Bash",
        "timeout": 2
      },
      {
        "hook": "test-filter.ts",
        "matcher": "Bash",
        "timeout": 5
      }
    ],
    "PostToolUse": [
      {
        "hook": "refactor-guard.ts",
        "matcher": "apply_patch|Edit|Write",
        "timeout": 5
      }
    ],
    "Stop": [
      {
        "hook": "persistent-mode.ts",
        "timeout": 30
      },
      {
        "hook": "refactor-guard.ts",
        "timeout": 5
      }
    ]
  }
}
